{
  "auth_profile": "unguess-oauth-oidc-v1",
  "principal_type": "human",
  "principal_id": "110000000000000000001",
  "delegated_subject": null,
  "actor_id": null,
  "client_id": "example-web-bff",
  "project_slug": "example-project",
  "resource_id": "https://example-resource.invalid/api",
  "capability_id": "example-project:records:read",
  "permissions": [],
  "scopes": [
    "example-project:records:read"
  ],
  "invocation_channel": "web",
  "access_session_id": "oauth_session_example_001",
  "authorization_grant_id": null,
  "token_id": "jti_oauth_example_001",
  "correlation_id": "corr_context_oauth_001",
  "trace_id": "4bf92f3577b34da6a3ce929d0e0e4736",
  "environment": "staging",
  "request_started_at": "2026-08-17T10:00:00Z"
}
